[
  {
    "object_id": "i-sep-a",
    "source_system": "rhino_bridge",
    "source_ref": "bridge:i-sep-a",
    "object_kind": "geometric_object",
    "raw_type": "Brep",
    "layer": "I",
    "name": "sep_a",
    "group_ids": [],
    "group_names": [],
    "block_context": { "is_block_instance": false, "block_name": null },
    "user_text": {},
    "material": null,
    "transform": [1,0,0,0,0,1,0,0,0,0,1,0,0,0,0,1],
    "geometry_ref": "rhino://i-sep-a",
    "raw_geometry_summary": {
      "bbox": { "min": [0.0, 0.0, 0.0], "max": [1.0, 1.0, 1.0] },
      "bbox_corners": [[0,0,0],[0,0,1],[0,1,0],[0,1,1],[1,0,0],[1,0,1],[1,1,0],[1,1,1]],
      "face_normals": [[1,0,0],[-1,0,0],[0,1,0],[0,-1,0],[0,0,1],[0,0,-1]],
      "face_areas": [1,1,1,1,1,1],
      "sample_points": [[0.5,0.5,0.5],[0,0,0],[1,1,1]],
      "volume": 1.0,
      "area": 6.0,
      "source": "rhino_bridge"
    },
    "extraction_warnings": []
  },
  {
    "object_id": "i-sep-b",
    "source_system": "rhino_bridge",
    "source_ref": "bridge:i-sep-b",
    "object_kind": "geometric_object",
    "raw_type": "Brep",
    "layer": "I",
    "name": "sep_b",
    "group_ids": [],
    "group_names": [],
    "block_context": { "is_block_instance": false, "block_name": null },
    "user_text": {},
    "material": null,
    "transform": [1,0,0,2.2,0,1,0,0,0,0,1,0,0,0,0,1],
    "geometry_ref": "rhino://i-sep-b",
    "raw_geometry_summary": {
      "bbox": { "min": [2.2, 0.0, 0.0], "max": [3.2, 1.0, 1.0] },
      "bbox_corners": [[2.2,0,0],[2.2,0,1],[2.2,1,0],[2.2,1,1],[3.2,0,0],[3.2,0,1],[3.2,1,0],[3.2,1,1]],
      "face_normals": [[1,0,0],[-1,0,0],[0,1,0],[0,-1,0],[0,0,1],[0,0,-1]],
      "face_areas": [1,1,1,1,1,1],
      "sample_points": [[2.7,0.5,0.5],[2.2,0,0],[3.2,1,1]],
      "volume": 1.0,
      "area": 6.0,
      "source": "rhino_bridge"
    },
    "extraction_warnings": []
  },
  {
    "object_id": "i-touch-a",
    "source_system": "rhino_bridge",
    "source_ref": "bridge:i-touch-a",
    "object_kind": "geometric_object",
    "raw_type": "Brep",
    "layer": "I",
    "name": "touch_a",
    "group_ids": [],
    "group_names": [],
    "block_context": { "is_block_instance": false, "block_name": null },
    "user_text": {},
    "material": null,
    "transform": [1,0,0,5,0,1,0,0,0,0,1,0,0,0,0,1],
    "geometry_ref": "rhino://i-touch-a",
    "raw_geometry_summary": {
      "bbox": { "min": [5.0, 0.0, 0.0], "max": [6.0, 1.0, 1.0] },
      "bbox_corners": [[5,0,0],[5,0,1],[5,1,0],[5,1,1],[6,0,0],[6,0,1],[6,1,0],[6,1,1]],
      "face_normals": [[1,0,0],[-1,0,0],[0,1,0],[0,-1,0],[0,0,1],[0,0,-1]],
      "face_areas": [1,1,1,1,1,1],
      "sample_points": [[5.5,0.5,0.5],[5,0,0],[6,1,1]],
      "volume": 1.0,
      "area": 6.0,
      "source": "rhino_bridge"
    },
    "extraction_warnings": []
  },
  {
    "object_id": "i-touch-b",
    "source_system": "rhino_bridge",
    "source_ref": "bridge:i-touch-b",
    "object_kind": "geometric_object",
    "raw_type": "Brep",
    "layer": "I",
    "name": "touch_b",
    "group_ids": [],
    "group_names": [],
    "block_context": { "is_block_instance": false, "block_name": null },
    "user_text": {},
    "material": null,
    "transform": [1,0,0,6,0,1,0,0,0,0,1,0,0,0,0,1],
    "geometry_ref": "rhino://i-touch-b",
    "raw_geometry_summary": {
      "bbox": { "min": [6.0, 0.0, 0.0], "max": [7.0, 1.0, 1.0] },
      "bbox_corners": [[6,0,0],[6,0,1],[6,1,0],[6,1,1],[7,0,0],[7,0,1],[7,1,0],[7,1,1]],
      "face_normals": [[1,0,0],[-1,0,0],[0,1,0],[0,-1,0],[0,0,1],[0,0,-1]],
      "face_areas": [1,1,1,1,1,1],
      "sample_points": [[6.5,0.5,0.5],[6,0,0],[7,1,1]],
      "volume": 1.0,
      "area": 6.0,
      "source": "rhino_bridge"
    },
    "extraction_warnings": []
  },
  {
    "object_id": "i-overlap-a",
    "source_system": "rhino_bridge",
    "source_ref": "bridge:i-overlap-a",
    "object_kind": "geometric_object",
    "raw_type": "Brep",
    "layer": "I",
    "name": "overlap_a",
    "group_ids": [],
    "group_names": [],
    "block_context": { "is_block_instance": false, "block_name": null },
    "user_text": {},
    "material": null,
    "transform": [1,0,0,9,0,1,0,0,0,0,1,0,0,0,0,1],
    "geometry_ref": "rhino://i-overlap-a",
    "raw_geometry_summary": {
      "bbox": { "min": [9.0, 0.0, 0.0], "max": [10.0, 1.0, 1.0] },
      "bbox_corners": [[9,0,0],[9,0,1],[9,1,0],[9,1,1],[10,0,0],[10,0,1],[10,1,0],[10,1,1]],
      "face_normals": [[1,0,0],[-1,0,0],[0,1,0],[0,-1,0],[0,0,1],[0,0,-1]],
      "face_areas": [1,1,1,1,1,1],
      "sample_points": [[9.5,0.5,0.5],[9,0,0],[10,1,1]],
      "volume": 1.0,
      "area": 6.0,
      "source": "rhino_bridge"
    },
    "extraction_warnings": []
  },
  {
    "object_id": "i-overlap-b",
    "source_system": "rhino_bridge",
    "source_ref": "bridge:i-overlap-b",
    "object_kind": "geometric_object",
    "raw_type": "Brep",
    "layer": "I",
    "name": "overlap_b",
    "group_ids": [],
    "group_names": [],
    "block_context": { "is_block_instance": false, "block_name": null },
    "user_text": {},
    "material": null,
    "transform": [1,0,0,9.5,0,1,0,0,0,0,1,0,0,0,0,1],
    "geometry_ref": "rhino://i-overlap-b",
    "raw_geometry_summary": {
      "bbox": { "min": [9.5, 0.0, 0.0], "max": [10.5, 1.0, 1.0] },
      "bbox_corners": [[9.5,0,0],[9.5,0,1],[9.5,1,0],[9.5,1,1],[10.5,0,0],[10.5,0,1],[10.5,1,0],[10.5,1,1]],
      "face_normals": [[1,0,0],[-1,0,0],[0,1,0],[0,-1,0],[0,0,1],[0,0,-1]],
      "face_areas": [1,1,1,1,1,1],
      "sample_points": [[10,0.5,0.5],[9.5,0,0],[10.5,1,1]],
      "volume": 1.0,
      "area": 6.0,
      "source": "rhino_bridge"
    },
    "extraction_warnings": []
  },
  {
    "object_id": "i-contained-outer",
    "source_system": "rhino_bridge",
    "source_ref": "bridge:i-contained-outer",
    "object_kind": "geometric_object",
    "raw_type": "Brep",
    "layer": "I",
    "name": "contained_outer",
    "group_ids": [],
    "group_names": [],
    "block_context": { "is_block_instance": false, "block_name": null },
    "user_text": {},
    "material": null,
    "transform": [1,0,0,12,0,1,0,0,0,0,1,0,0,0,0,1],
    "geometry_ref": "rhino://i-contained-outer",
    "raw_geometry_summary": {
      "bbox": { "min": [12.0, 0.0, 0.0], "max": [14.0, 2.0, 2.0] },
      "bbox_corners": [[12,0,0],[12,0,2],[12,2,0],[12,2,2],[14,0,0],[14,0,2],[14,2,0],[14,2,2]],
      "face_normals": [[1,0,0],[-1,0,0],[0,1,0],[0,-1,0],[0,0,1],[0,0,-1]],
      "face_areas": [4,4,4,4,4,4],
      "sample_points": [[13,1,1],[12,0,0],[14,2,2]],
      "volume": 8.0,
      "area": 24.0,
      "source": "rhino_bridge"
    },
    "extraction_warnings": []
  },
  {
    "object_id": "i-contained-inner",
    "source_system": "rhino_bridge",
    "source_ref": "bridge:i-contained-inner",
    "object_kind": "geometric_object",
    "raw_type": "Brep",
    "layer": "I",
    "name": "contained_inner",
    "group_ids": [],
    "group_names": [],
    "block_context": { "is_block_instance": false, "block_name": null },
    "user_text": {},
    "material": null,
    "transform": [1,0,0,12.5,0,1,0,0,0,0,1,0,0,0,0,1],
    "geometry_ref": "rhino://i-contained-inner",
    "raw_geometry_summary": {
      "bbox": { "min": [12.5, 0.5, 0.5], "max": [13.0, 1.0, 1.0] },
      "bbox_corners": [[12.5,0.5,0.5],[12.5,0.5,1],[12.5,1,0.5],[12.5,1,1],[13,0.5,0.5],[13,0.5,1],[13,1,0.5],[13,1,1]],
      "face_normals": [[1,0,0],[-1,0,0],[0,1,0],[0,-1,0],[0,0,1],[0,0,-1]],
      "face_areas": [0.25,0.25,0.25,0.25,0.25,0.25],
      "sample_points": [[12.75,0.75,0.75],[12.5,0.5,0.5],[13,1,1]],
      "volume": 0.125,
      "area": 1.5,
      "source": "rhino_bridge"
    },
    "extraction_warnings": []
  },
  {
    "object_id": "i-coplanar-a",
    "source_system": "rhino_bridge",
    "source_ref": "bridge:i-coplanar-a",
    "object_kind": "geometric_object",
    "raw_type": "Brep",
    "layer": "I",
    "name": "coplanar_a",
    "group_ids": [],
    "group_names": [],
    "block_context": { "is_block_instance": false, "block_name": null },
    "user_text": {},
    "material": null,
    "transform": [1,0,0,16,0,1,0,0,0,0,1,0,0,0,0,1],
    "geometry_ref": "rhino://i-coplanar-a",
    "raw_geometry_summary": {
      "bbox": { "min": [16.0, 0.0, 0.0], "max": [17.0, 1.0, 0.2] },
      "bbox_corners": [[16,0,0],[16,0,0.2],[16,1,0],[16,1,0.2],[17,0,0],[17,0,0.2],[17,1,0],[17,1,0.2]],
      "face_normals": [[0,0,1],[0,0,-1],[1,0,0],[-1,0,0],[0,1,0],[0,-1,0]],
      "face_areas": [1,1,0.2,0.2,0.2,0.2],
      "sample_points": [[16.5,0.5,0.1],[16,0,0],[17,1,0.2]],
      "volume": 0.2,
      "area": 2.8,
      "source": "rhino_bridge"
    },
    "extraction_warnings": []
  },
  {
    "object_id": "i-coplanar-b",
    "source_system": "rhino_bridge",
    "source_ref": "bridge:i-coplanar-b",
    "object_kind": "geometric_object",
    "raw_type": "Brep",
    "layer": "I",
    "name": "coplanar_b",
    "group_ids": [],
    "group_names": [],
    "block_context": { "is_block_instance": false, "block_name": null },
    "user_text": {},
    "material": null,
    "transform": [1,0,0,16.2,0,1,0,0,0,0,1,0,0,0,0,1],
    "geometry_ref": "rhino://i-coplanar-b",
    "raw_geometry_summary": {
      "bbox": { "min": [16.2, 0.2, 0.0], "max": [17.2, 1.2, 0.2] },
      "bbox_corners": [[16.2,0.2,0],[16.2,0.2,0.2],[16.2,1.2,0],[16.2,1.2,0.2],[17.2,0.2,0],[17.2,0.2,0.2],[17.2,1.2,0],[17.2,1.2,0.2]],
      "face_normals": [[0,0,1],[0,0,-1],[1,0,0],[-1,0,0],[0,1,0],[0,-1,0]],
      "face_areas": [1,1,0.2,0.2,0.2,0.2],
      "sample_points": [[16.7,0.7,0.1],[16.2,0.2,0],[17.2,1.2,0.2]],
      "volume": 0.2,
      "area": 2.8,
      "source": "rhino_bridge"
    },
    "extraction_warnings": []
  }
]
