[
  {
    "object_id": "b-001",
    "source_system": "rhino_bridge",
    "source_ref": "bridge:1",
    "object_kind": "geometric_object",
    "raw_type": "Brep",
    "layer": "A",
    "name": "obj_1",
    "group_ids": ["grp-x"],
    "group_names": ["grp-x"],
    "block_context": { "is_block_instance": false, "block_name": null },
    "user_text": { "AssemblyId": "A-01", "CF.PartId": "P-01" },
    "material": null,
    "transform": [1,0,0,0,0,1,0,0,0,0,1,0,0,0,0,1],
    "geometry_ref": "rhino://bridge:1",
    "raw_geometry_summary": {
      "bbox": { "min": [0.0, 0.0, 0.0], "max": [1.0, 1.0, 1.0] },
      "bbox_corners": [[0,0,0],[0,0,1],[0,1,0],[0,1,1],[1,0,0],[1,0,1],[1,1,0],[1,1,1]],
      "face_count": 6,
      "face_normals": [[1,0,0],[-1,0,0],[0,1,0],[0,-1,0],[0,0,1],[0,0,-1]],
      "face_areas": [1,1,1,1,1,1],
      "is_closed": true,
      "volume": 1.0,
      "area": 6.0,
      "source": "rhino_bridge"
    },
    "extraction_warnings": []
  },
  {
    "object_id": "b-002",
    "source_system": "rhino_bridge",
    "source_ref": "bridge:2",
    "object_kind": "geometric_object",
    "raw_type": "Brep",
    "layer": "A",
    "name": "obj_2",
    "group_ids": ["grp-x"],
    "group_names": ["grp-x"],
    "block_context": { "is_block_instance": false, "block_name": null },
    "user_text": { "AssemblyId": "A-01", "CF.PartId": "P-02" },
    "material": null,
    "transform": [1,0,0,1.1,0,1,0,0,0,0,1,0,0,0,0,1],
    "geometry_ref": "rhino://bridge:2",
    "raw_geometry_summary": {
      "bbox": { "min": [1.1, 0.0, 0.0], "max": [2.1, 1.0, 1.0] },
      "bbox_corners": [[1.1,0,0],[1.1,0,1],[1.1,1,0],[1.1,1,1],[2.1,0,0],[2.1,0,1],[2.1,1,0],[2.1,1,1]],
      "face_count": 6,
      "face_normals": [[1,0,0],[-1,0,0],[0,1,0],[0,-1,0],[0,0,1],[0,0,-1]],
      "face_areas": [1,1,1,1,1,1],
      "is_closed": true,
      "volume": 1.0,
      "area": 6.0,
      "source": "rhino_bridge"
    },
    "extraction_warnings": []
  },
  {
    "object_id": "b-003",
    "source_system": "rhino_bridge",
    "source_ref": "bridge:3",
    "object_kind": "geometric_object",
    "raw_type": "Brep",
    "layer": "A",
    "name": "obj_3",
    "group_ids": ["grp-y"],
    "group_names": ["grp-y"],
    "block_context": { "is_block_instance": false, "block_name": null },
    "user_text": { "AssemblyId": "A-02", "CF.PartId": "P-03" },
    "material": null,
    "transform": [1,0,0,4.0,0,1,0,0,0,0,1,0,0,0,0,1],
    "geometry_ref": "rhino://bridge:3",
    "raw_geometry_summary": {
      "bbox": { "min": [4.0, 0.0, 0.0], "max": [5.0, 1.0, 1.0] },
      "bbox_corners": [[4,0,0],[4,0,1],[4,1,0],[4,1,1],[5,0,0],[5,0,1],[5,1,0],[5,1,1]],
      "face_count": 6,
      "face_normals": [[1,0,0],[-1,0,0],[0,1,0],[0,-1,0],[0,0,1],[0,0,-1]],
      "face_areas": [1,1,1,1,1,1],
      "is_closed": true,
      "volume": 1.0,
      "area": 6.0,
      "source": "rhino_bridge"
    },
    "extraction_warnings": []
  }
]
